{"$defs":{"capability-id":{"enum":["network.outbound.allowlisted","process.exec.named","project.read.declared","project.write.owned","runtime.terminal.assigned-node","secret.use.named","skill.invoke.declared","workbench.read.declared","workbench.write.artifact","workbench.write.tmp"]},"portable-path":{"maxLength":1024,"pattern":"^(?!/)(?![A-Za-z]:)(?!.*\\\\)(?!.*:)(?!.*(?:^|/)(?:\\.|\\.\\.)(?:/|$))(?!.*(?:^|/)(?:[cC][oO][nN]|[pP][rR][nN]|[aA][uU][xX]|[nN][uU][lL]|[cC][oO][mM][1-9]|[lL][pP][tT][1-9])(?:\\.[^/]*)?(?:/|$))(?!.*[. ](?:/|$))[^\\u0000-\\u001f/]+(?:/[^\\u0000-\\u001f/]+)*$","type":"string"},"slug":{"pattern":"^[a-z0-9]+(?:-[a-z0-9]+)*$","type":"string"}},"$id":"https://xcoding.invalid/schemas/worker-profile-v1.schema.json","$schema":"https://json-schema.org/draft/2020-12/schema","additionalProperties":false,"properties":{"capabilities":{"items":{"additionalProperties":false,"allOf":[{"if":{"properties":{"id":{"enum":["project.read.declared","project.write.owned","workbench.read.declared","workbench.write.artifact","workbench.write.tmp"]}},"required":["id"]},"then":{"properties":{"values":{"items":{"$ref":"#/$defs/portable-path"}}}}},{"if":{"properties":{"id":{"const":"runtime.terminal.assigned-node"}},"required":["id"]},"then":{"properties":{"values":{"items":{"enum":["block","complete","fail"]}}}}},{"if":{"properties":{"id":{"const":"network.outbound.allowlisted"}},"required":["id"]},"then":{"properties":{"values":{"items":{"pattern":"^[a-z0-9.-]+(?::[0-9]{1,5})?$","type":"string"}}}}},{"if":{"properties":{"id":{"enum":["process.exec.named","secret.use.named","skill.invoke.declared"]}},"required":["id"]},"then":{"properties":{"values":{"items":{"$ref":"#/$defs/slug"}}}}}],"properties":{"id":{"$ref":"#/$defs/capability-id"},"requirement":{"enum":["optional","required"]},"values":{"items":{"allOf":[{"not":{"const":"*"}},{"maxLength":1024,"minLength":1,"type":"string"}]},"maxItems":128,"minItems":1,"type":"array","uniqueItems":true}},"required":["id","requirement","values"],"type":"object"},"maxItems":10,"type":"array"},"capability_vocabulary":{"const":"xc-delegation-capabilities/v1"},"compatibility":{"additionalProperties":false,"properties":{"legacy_fallback":{"const":false},"on_unsupported":{"const":"block"}},"required":["legacy_fallback","on_unsupported"],"type":"object"},"context":{"additionalProperties":false,"properties":{"bindings":{"items":{"additionalProperties":false,"properties":{"id":{"$ref":"#/$defs/slug"},"required":{"type":"boolean"}},"required":["id","required"],"type":"object"},"maxItems":64,"type":"array"},"max_bytes":{"maximum":65536,"minimum":0,"type":"integer"}},"required":["bindings","max_bytes"],"type":"object"},"delegation":{"additionalProperties":false,"properties":{"allowed":{"const":false},"max_depth":{"const":0}},"required":["allowed","max_depth"],"type":"object"},"description":{"maxLength":4096,"minLength":1,"type":"string"},"failure_policy":{"additionalProperties":false,"properties":{"on_invalid_input":{"const":"block"},"on_required_capability":{"const":"block"},"silent_fallback":{"const":false}},"required":["on_invalid_input","on_required_capability","silent_fallback"],"type":"object"},"instruction_resources":{"items":{"$ref":"#/$defs/portable-path"},"maxItems":16,"minItems":1,"type":"array","uniqueItems":true},"outputs":{"additionalProperties":false,"properties":{"artifacts":{"items":{"additionalProperties":false,"properties":{"id":{"$ref":"#/$defs/slug"},"path":{"$ref":"#/$defs/portable-path"},"required":{"type":"boolean"}},"required":["id","path","required"],"type":"object"},"maxItems":32,"type":"array"},"result_fields":{"items":{"$ref":"#/$defs/slug"},"maxItems":32,"type":"array","uniqueItems":true}},"required":["artifacts","result_fields"],"type":"object"},"owner_skill":{"pattern":"^xc-[a-z0-9]+(?:-[a-z0-9]+)*$","type":"string"},"profile_id":{"$ref":"#/$defs/slug"},"required_skills":{"items":{"pattern":"^xc-[a-z0-9]+(?:-[a-z0-9]+)*$","type":"string"},"maxItems":32,"type":"array","uniqueItems":true},"schema_version":{"const":1}},"required":["schema_version","profile_id","owner_skill","description","instruction_resources","required_skills","capability_vocabulary","capabilities","context","outputs","delegation","failure_policy","compatibility"],"title":"XC Skill-local Worker Profile v1","type":"object"}
