{"capabilities":[{"id":"process.exec.named","requirement":"required","values":["git","python","xcoding"]},{"id":"project.read.declared","requirement":"required","values":[".xcoding/WORKFLOW.md","skills","src","tests"]},{"id":"runtime.terminal.assigned-node","requirement":"required","values":["block","complete","fail"]},{"id":"skill.invoke.declared","requirement":"required","values":["xc-verification"]},{"id":"workbench.read.declared","requirement":"required","values":["artifacts","solution.md"]},{"id":"workbench.write.artifact","requirement":"required","values":["artifacts/verification-final-regression/report.md"]},{"id":"workbench.write.tmp","requirement":"required","values":["tmp"]}],"capability_vocabulary":"xc-delegation-capabilities/v1","compatibility":{"legacy_fallback":false,"on_unsupported":"block"},"context":{"bindings":[{"id":"target-contract","required":true}],"max_bytes":16384},"delegation":{"allowed":false,"max_depth":0},"description":"Run the complete repository regression after the final implementation and review gates for one managed work-order node.","failure_policy":{"on_invalid_input":"block","on_required_capability":"block","silent_fallback":false},"instruction_resources":["assets/workers/final-regression-rerun/instructions.md"],"outputs":{"artifacts":[{"id":"report","path":"artifacts/verification-final-regression/report.md","required":true}],"result_fields":["summary","validation"]},"owner_skill":"xc-verification","profile_id":"final-regression-rerun","required_skills":["xc-verification"],"schema_version":1}
