{"capabilities":[{"id":"process.exec.named","requirement":"required","values":["git","python","xcoding"]},{"id":"project.read.declared","requirement":"required","values":[".xcoding/WORKFLOW.md","README.md","README.zh-CN.md","docs","skills","src","tests"]},{"id":"runtime.terminal.assigned-node","requirement":"required","values":["block","complete","fail"]},{"id":"skill.invoke.declared","requirement":"required","values":["xc-review"]},{"id":"workbench.read.declared","requirement":"required","values":["artifacts","solution.md"]},{"id":"workbench.write.artifact","requirement":"required","values":["artifacts/review-bilingual-docs-final/report.md"]},{"id":"workbench.write.tmp","requirement":"required","values":["tmp"]}],"capability_vocabulary":"xc-delegation-capabilities/v1","compatibility":{"legacy_fallback":false,"on_unsupported":"block"},"context":{"bindings":[{"id":"target-contract","required":true}],"max_bytes":16384},"delegation":{"allowed":false,"max_depth":0},"description":"Independently review the complete English and zh-CN public documentation contract.","failure_policy":{"on_invalid_input":"block","on_required_capability":"block","silent_fallback":false},"instruction_resources":["assets/workers/final-bilingual-docs-review/instructions.md"],"outputs":{"artifacts":[{"id":"report","path":"artifacts/review-bilingual-docs-final/report.md","required":true}],"result_fields":["summary","validation"]},"owner_skill":"xc-review","profile_id":"final-bilingual-docs-review","required_skills":["xc-review"],"schema_version":1}
