{"capabilities":[{"id":"process.exec.named","requirement":"required","values":["git","python","xcoding"]},{"id":"project.read.declared","requirement":"required","values":[".xcoding/WORKFLOW.md","skills/xc-delegation","skills/xc-implementation","src/xcoding/delegation","src/xcoding/runtime","tests"]},{"id":"project.write.owned","requirement":"required","values":["src/xcoding/delegation","src/xcoding/runtime","tests"]},{"id":"runtime.terminal.assigned-node","requirement":"required","values":["block","complete","fail"]},{"id":"skill.invoke.declared","requirement":"required","values":["xc-document","xc-implementation"]},{"id":"workbench.read.declared","requirement":"required","values":["artifacts","solution.md"]},{"id":"workbench.write.artifact","requirement":"required","values":["artifacts/repair-final-gateway-security/report.md"]},{"id":"workbench.write.tmp","requirement":"required","values":["tmp"]}],"capability_vocabulary":"xc-delegation-capabilities/v1","compatibility":{"legacy_fallback":false,"on_unsupported":"block"},"context":{"bindings":[{"id":"target-contract","required":true}],"max_bytes":16384},"delegation":{"allowed":false,"max_depth":0},"description":"Repairs one bounded set of independently reviewed implementation findings and records reproducible validation evidence.","failure_policy":{"on_invalid_input":"block","on_required_capability":"block","silent_fallback":false},"instruction_resources":["assets/workers/review-findings-repair/instructions.md"],"outputs":{"artifacts":[{"id":"report","path":"artifacts/repair-final-gateway-security/report.md","required":true}],"result_fields":["summary","validation"]},"owner_skill":"xc-implementation","profile_id":"review-findings-repair","required_skills":["xc-document","xc-implementation"],"schema_version":1}
