{"capabilities":[{"id":"process.exec.named","requirement":"optional","values":["git-status"]},{"id":"project.read.declared","requirement":"required","values":["README.md"]},{"id":"runtime.terminal.assigned-node","requirement":"required","values":["block","complete","fail"]},{"id":"skill.invoke.declared","requirement":"optional","values":["xc-analysis"]},{"id":"workbench.write.artifact","requirement":"required","values":["artifacts/evidence.md"]}],"capability_vocabulary":"xc-delegation-capabilities/v1","compatibility":{"legacy_fallback":false,"on_unsupported":"block"},"context":{"bindings":[{"id":"target-contract","required":true}],"max_bytes":8192},"delegation":{"allowed":false,"max_depth":0},"description":"Collect read-only evidence for one declared target and write one bounded artifact.","failure_policy":{"on_invalid_input":"block","on_required_capability":"block","silent_fallback":false},"instruction_resources":["assets/workers/read-only-evidence/instructions.md"],"outputs":{"artifacts":[{"id":"evidence","path":"artifacts/evidence.md","required":true}],"result_fields":["summary","validation"]},"owner_skill":"xc-delegation","profile_id":"read-only-evidence","required_skills":["xc-analysis"],"schema_version":1}
